{
  "schemaVersion": 1,
  "courseLength": 68,
  "lessonIds": [
    "lesson-1",
    "lesson-2",
    "lesson-3",
    "bpb-balanced-arrival",
    "bpb-keyboard-landmarks",
    "lesson-4",
    "lesson-5",
    "bpb-bass-anchors",
    "lesson-9",
    "lesson-10",
    "bpb-read-direction",
    "lesson-11",
    "lesson-12",
    "bpb-pulse-and-space",
    "lesson-13",
    "lesson-6",
    "lesson-7",
    "lesson-8",
    "bpb-two-phrases",
    "bpb-c-scale-rh",
    "bpb-c-scale-lh",
    "lesson-14",
    "lesson-15",
    "bpb-g-scale-rh",
    "bpb-d-scale-rh",
    "bpb-f-scale-rh",
    "lesson-16",
    "bpb-c-arpeggio-rh",
    "bpb-c-arpeggio-lh",
    "bpb-scale-fragments",
    "lesson-17",
    "lesson-18",
    "lesson-19",
    "lesson-20",
    "lesson-21",
    "bpb-major-minor-third",
    "bpb-triad-inversions",
    "bpb-roots-and-fifths",
    "bpb-primary-chords",
    "bpb-dominant-return",
    "bpb-transpose-to-d",
    "bpb-transpose-to-g",
    "bpb-melody-and-bass",
    "lesson-22",
    "lesson-23",
    "bpb-a-natural-minor",
    "bpb-a-harmonic-minor",
    "bpb-a-melodic-minor",
    "bpb-e-natural-minor",
    "bpb-d-natural-minor",
    "lesson-24",
    "lesson-25",
    "lesson-26",
    "lesson-27",
    "lesson-28",
    "lesson-29",
    "lesson-30",
    "lesson-31",
    "lesson-32",
    "lesson-33",
    "bpb-reading-scan",
    "bpb-inner-hearing",
    "bpb-quiet-pedal-listening",
    "bpb-small-improvisation",
    "lesson-34",
    "lesson-35",
    "lesson-36",
    "bpb-year-one-journey",
    "repertoire-hot-cross-buns",
    "repertoire-mary-had-a-little-lamb",
    "repertoire-twinkle-twinkle-little-star",
    "repertoire-fr-re-jacques",
    "repertoire-london-bridge",
    "repertoire-row-row-row-your-boat",
    "repertoire-ode-to-joy",
    "repertoire-jingle-bells",
    "repertoire-old-macdonald",
    "repertoire-when-the-saints-go-marching-in",
    "repertoire-au-clair-de-la-lune",
    "repertoire-lightly-row",
    "repertoire-go-tell-aunt-rhody",
    "repertoire-this-old-man",
    "repertoire-alouette",
    "repertoire-yankee-doodle",
    "repertoire-skip-to-my-lou",
    "repertoire-the-muffin-man",
    "repertoire-pop-goes-the-weasel",
    "repertoire-bingo",
    "repertoire-a-tisket-a-tasket",
    "repertoire-hickory-dickory-dock",
    "repertoire-three-blind-mice",
    "repertoire-hush-little-baby",
    "repertoire-lavender-s-blue",
    "repertoire-polly-put-the-kettle-on",
    "repertoire-the-farmer-in-the-dell",
    "repertoire-rock-a-bye-baby",
    "repertoire-for-he-s-a-jolly-good-fellow",
    "repertoire-happy-birthday",
    "repertoire-amazing-grace",
    "repertoire-auld-lang-syne",
    "repertoire-shenandoah",
    "repertoire-red-river-valley",
    "repertoire-home-on-the-range",
    "repertoire-oh-susanna",
    "repertoire-camptown-races",
    "repertoire-my-bonnie-lies-over-the-ocean",
    "repertoire-danny-boy",
    "repertoire-loch-lomond",
    "repertoire-annie-laurie",
    "repertoire-scotland-the-brave",
    "repertoire-greensleeves",
    "repertoire-scarborough-fair",
    "repertoire-the-water-is-wide",
    "repertoire-drunken-sailor",
    "repertoire-wellerman",
    "repertoire-blow-the-man-down",
    "repertoire-sakura-sakura",
    "repertoire-swannee-river",
    "repertoire-aura-lee",
    "repertoire-beautiful-dreamer",
    "repertoire-carry-me-back-to-old-virginny",
    "repertoire-the-blue-bells-of-scotland",
    "repertoire-the-ash-grove",
    "repertoire-early-one-morning",
    "repertoire-spanish-romance",
    "repertoire-silent-night",
    "repertoire-joy-to-the-world",
    "repertoire-we-wish-you-a-merry-christmas",
    "repertoire-deck-the-halls",
    "repertoire-the-first-noel",
    "repertoire-o-come-all-ye-faithful",
    "repertoire-god-rest-ye-merry-gentlemen",
    "repertoire-away-in-a-manger",
    "repertoire-o-christmas-tree",
    "repertoire-ding-dong-merrily-on-high",
    "repertoire-good-king-wenceslas",
    "repertoire-o-come-o-come-emmanuel",
    "repertoire-hark-the-herald-angels-sing",
    "repertoire-angels-we-have-heard-on-high",
    "repertoire-carol-of-the-bells",
    "repertoire-minuet-in-g-bwv-anh-114",
    "repertoire-musette-in-d-bwv-anh-126",
    "repertoire-prelude-in-c-bwv846",
    "repertoire-jesu-joy-of-man-s-desiring",
    "repertoire-air-on-the-g-string",
    "repertoire-f-r-elise",
    "repertoire-moonlight-sonata-opening",
    "repertoire-symphony-no-5-opening",
    "repertoire-turkish-march-opening",
    "repertoire-eine-kleine-nachtmusik",
    "repertoire-sonata-facile-k545",
    "repertoire-lacrimosa-opening",
    "repertoire-ombra-mai-fu",
    "repertoire-sarabande-in-d-minor",
    "repertoire-spring-from-the-four-seasons",
    "repertoire-largo-from-new-world-symphony",
    "repertoire-ode-to-the-evening-star",
    "repertoire-morning-mood",
    "repertoire-in-the-hall-of-the-mountain-king",
    "repertoire-william-tell-overture",
    "repertoire-blue-danube",
    "repertoire-can-can",
    "repertoire-hungarian-dance-no-5",
    "repertoire-brahms-lullaby",
    "repertoire-gymnop-die-no-1",
    "repertoire-clair-de-lune-opening",
    "repertoire-the-entertainer",
    "repertoire-maple-leaf-rag-opening",
    "game-study-1",
    "game-study-2",
    "game-study-3",
    "game-study-4",
    "game-study-5",
    "game-study-6",
    "game-study-7",
    "game-study-8",
    "game-study-9",
    "game-study-10",
    "game-study-11",
    "game-study-12",
    "game-study-13",
    "game-study-14",
    "game-study-15",
    "game-study-16",
    "game-study-17",
    "game-study-18",
    "game-study-19",
    "game-study-20",
    "game-study-21",
    "game-study-22",
    "game-study-23",
    "game-study-24",
    "game-study-25",
    "game-study-26",
    "game-study-27",
    "game-study-28",
    "game-study-29",
    "game-study-30",
    "pop-seven-nation",
    "pop-take-on-me",
    "pop-never-gonna",
    "pop-final-countdown",
    "pop-bad-guy",
    "pop-blinding-lights",
    "meme-coffin",
    "meme-sax",
    "meme-crab",
    "meme-nokia",
    "meme-shark",
    "meme-sea"
  ],
  "melodyIds": [
    "repertoire-hot-cross-buns",
    "repertoire-mary-had-a-little-lamb",
    "repertoire-twinkle-twinkle-little-star",
    "repertoire-fr-re-jacques",
    "repertoire-london-bridge",
    "repertoire-row-row-row-your-boat",
    "repertoire-ode-to-joy",
    "repertoire-jingle-bells",
    "repertoire-old-macdonald",
    "repertoire-when-the-saints-go-marching-in",
    "repertoire-au-clair-de-la-lune",
    "repertoire-lightly-row",
    "repertoire-go-tell-aunt-rhody",
    "repertoire-this-old-man",
    "repertoire-alouette",
    "repertoire-yankee-doodle",
    "repertoire-skip-to-my-lou",
    "repertoire-the-muffin-man",
    "repertoire-pop-goes-the-weasel",
    "repertoire-bingo",
    "repertoire-a-tisket-a-tasket",
    "repertoire-hickory-dickory-dock",
    "repertoire-three-blind-mice",
    "repertoire-hush-little-baby",
    "repertoire-lavender-s-blue",
    "repertoire-polly-put-the-kettle-on",
    "repertoire-the-farmer-in-the-dell",
    "repertoire-rock-a-bye-baby",
    "repertoire-for-he-s-a-jolly-good-fellow",
    "repertoire-happy-birthday",
    "repertoire-amazing-grace",
    "repertoire-auld-lang-syne",
    "repertoire-shenandoah",
    "repertoire-red-river-valley",
    "repertoire-home-on-the-range",
    "repertoire-oh-susanna",
    "repertoire-camptown-races",
    "repertoire-my-bonnie-lies-over-the-ocean",
    "repertoire-danny-boy",
    "repertoire-loch-lomond",
    "repertoire-annie-laurie",
    "repertoire-scotland-the-brave",
    "repertoire-greensleeves",
    "repertoire-scarborough-fair",
    "repertoire-the-water-is-wide",
    "repertoire-drunken-sailor",
    "repertoire-wellerman",
    "repertoire-blow-the-man-down",
    "repertoire-sakura-sakura",
    "repertoire-swannee-river",
    "repertoire-aura-lee",
    "repertoire-beautiful-dreamer",
    "repertoire-carry-me-back-to-old-virginny",
    "repertoire-the-blue-bells-of-scotland",
    "repertoire-the-ash-grove",
    "repertoire-early-one-morning",
    "repertoire-spanish-romance",
    "repertoire-silent-night",
    "repertoire-joy-to-the-world",
    "repertoire-we-wish-you-a-merry-christmas",
    "repertoire-deck-the-halls",
    "repertoire-the-first-noel",
    "repertoire-o-come-all-ye-faithful",
    "repertoire-god-rest-ye-merry-gentlemen",
    "repertoire-away-in-a-manger",
    "repertoire-o-christmas-tree",
    "repertoire-ding-dong-merrily-on-high",
    "repertoire-good-king-wenceslas",
    "repertoire-o-come-o-come-emmanuel",
    "repertoire-hark-the-herald-angels-sing",
    "repertoire-angels-we-have-heard-on-high",
    "repertoire-carol-of-the-bells",
    "repertoire-minuet-in-g-bwv-anh-114",
    "repertoire-musette-in-d-bwv-anh-126",
    "repertoire-prelude-in-c-bwv846",
    "repertoire-jesu-joy-of-man-s-desiring",
    "repertoire-air-on-the-g-string",
    "repertoire-f-r-elise",
    "repertoire-moonlight-sonata-opening",
    "repertoire-symphony-no-5-opening",
    "repertoire-turkish-march-opening",
    "repertoire-eine-kleine-nachtmusik",
    "repertoire-sonata-facile-k545",
    "repertoire-lacrimosa-opening",
    "repertoire-ombra-mai-fu",
    "repertoire-sarabande-in-d-minor",
    "repertoire-spring-from-the-four-seasons",
    "repertoire-largo-from-new-world-symphony",
    "repertoire-ode-to-the-evening-star",
    "repertoire-morning-mood",
    "repertoire-in-the-hall-of-the-mountain-king",
    "repertoire-william-tell-overture",
    "repertoire-blue-danube",
    "repertoire-can-can",
    "repertoire-hungarian-dance-no-5",
    "repertoire-brahms-lullaby",
    "repertoire-gymnop-die-no-1",
    "repertoire-clair-de-lune-opening",
    "repertoire-the-entertainer",
    "repertoire-maple-leaf-rag-opening",
    "game-study-1",
    "game-study-2",
    "game-study-3",
    "game-study-4",
    "game-study-5",
    "game-study-6",
    "game-study-7",
    "game-study-8",
    "game-study-9",
    "game-study-10",
    "game-study-11",
    "game-study-12",
    "game-study-13",
    "game-study-14",